{
  "protocolVersion": 2,
  "catalogVersion": "revit-mcp-local-v2",
  "catalogHash": "1cccdf796f16c278a8b14cc94f5b24b3b4d26a00f4d45135cecf77a4e729f743",
  "localToolCount": 152,
  "excludedCloudTools": [
    "query_stored_data",
    "store_project_data",
    "store_room_data"
  ],
  "tools": [
    {
      "name": "ai_element_filter",
      "mutationClass": "read",
      "retryPolicy": "read_only",
      "timeoutMs": 30000,
      "createdIdsRequired": false,
      "sessionTagSupported": false,
      "automaticRollbackAllowed": false,
      "maxArgsBytes": 1048576,
      "maxResultBytes": 4194304
    },
    {
      "name": "analyze_layout_design",
      "mutationClass": "read",
      "retryPolicy": "read_only",
      "timeoutMs": 30000,
      "createdIdsRequired": false,
      "sessionTagSupported": false,
      "automaticRollbackAllowed": false,
      "maxArgsBytes": 1048576,
      "maxResultBytes": 4194304
    },
    {
      "name": "analyze_solar_exposure",
      "mutationClass": "read",
      "retryPolicy": "read_only",
      "timeoutMs": 30000,
      "createdIdsRequired": false,
      "sessionTagSupported": false,
      "automaticRollbackAllowed": false,
      "maxArgsBytes": 1048576,
      "maxResultBytes": 4194304
    },
    {
      "name": "apply_structural_loads",
      "mutationClass": "mutation",
      "retryPolicy": "never",
      "timeoutMs": 180000,
      "createdIdsRequired": false,
      "sessionTagSupported": false,
      "automaticRollbackAllowed": false,
      "maxArgsBytes": 1048576,
      "maxResultBytes": 4194304
    },
    {
      "name": "apply_view_filter",
      "mutationClass": "mutation",
      "retryPolicy": "never",
      "timeoutMs": 180000,
      "createdIdsRequired": false,
      "sessionTagSupported": false,
      "automaticRollbackAllowed": false,
      "maxArgsBytes": 1048576,
      "maxResultBytes": 4194304
    },
    {
      "name": "apply_view_template",
      "mutationClass": "dangerous",
      "retryPolicy": "never",
      "timeoutMs": 180000,
      "createdIdsRequired": false,
      "sessionTagSupported": false,
      "automaticRollbackAllowed": false,
      "maxArgsBytes": 1048576,
      "maxResultBytes": 4194304
    },
    {
      "name": "array_elements",
      "mutationClass": "mutation",
      "retryPolicy": "never",
      "timeoutMs": 180000,
      "createdIdsRequired": true,
      "sessionTagSupported": false,
      "automaticRollbackAllowed": false,
      "maxArgsBytes": 1048576,
      "maxResultBytes": 4194304
    },
    {
      "name": "auto_align_elements",
      "mutationClass": "mutation",
      "retryPolicy": "never",
      "timeoutMs": 180000,
      "createdIdsRequired": false,
      "sessionTagSupported": false,
      "automaticRollbackAllowed": false,
      "maxArgsBytes": 1048576,
      "maxResultBytes": 4194304
    },
    {
      "name": "auto_furnish_room",
      "mutationClass": "dangerous",
      "retryPolicy": "never",
      "timeoutMs": 180000,
      "createdIdsRequired": true,
      "sessionTagSupported": false,
      "automaticRollbackAllowed": false,
      "maxArgsBytes": 1048576,
      "maxResultBytes": 4194304
    },
    {
      "name": "batch_dimension_elements",
      "mutationClass": "mutation",
      "retryPolicy": "never",
      "timeoutMs": 180000,
      "createdIdsRequired": true,
      "sessionTagSupported": false,
      "automaticRollbackAllowed": false,
      "maxArgsBytes": 1048576,
      "maxResultBytes": 4194304
    },
    {
      "name": "batch_tag_elements",
      "mutationClass": "mutation",
      "retryPolicy": "never",
      "timeoutMs": 180000,
      "createdIdsRequired": true,
      "sessionTagSupported": false,
      "automaticRollbackAllowed": false,
      "maxArgsBytes": 1048576,
      "maxResultBytes": 4194304
    },
    {
      "name": "calculate_carbon_footprint",
      "mutationClass": "read",
      "retryPolicy": "read_only",
      "timeoutMs": 30000,
      "createdIdsRequired": false,
      "sessionTagSupported": false,
      "automaticRollbackAllowed": false,
      "maxArgsBytes": 1048576,
      "maxResultBytes": 4194304
    },
    {
      "name": "calculate_costs",
      "mutationClass": "read",
      "retryPolicy": "read_only",
      "timeoutMs": 30000,
      "createdIdsRequired": false,
      "sessionTagSupported": false,
      "automaticRollbackAllowed": false,
      "maxArgsBytes": 1048576,
      "maxResultBytes": 4194304
    },
    {
      "name": "calculate_daylighting",
      "mutationClass": "read",
      "retryPolicy": "read_only",
      "timeoutMs": 30000,
      "createdIdsRequired": false,
      "sessionTagSupported": false,
      "automaticRollbackAllowed": false,
      "maxArgsBytes": 1048576,
      "maxResultBytes": 4194304
    },
    {
      "name": "calculate_electrical_load",
      "mutationClass": "read",
      "retryPolicy": "read_only",
      "timeoutMs": 30000,
      "createdIdsRequired": false,
      "sessionTagSupported": false,
      "automaticRollbackAllowed": false,
      "maxArgsBytes": 1048576,
      "maxResultBytes": 4194304
    },
    {
      "name": "calculate_hvac_load",
      "mutationClass": "read",
      "retryPolicy": "read_only",
      "timeoutMs": 30000,
      "createdIdsRequired": false,
      "sessionTagSupported": false,
      "automaticRollbackAllowed": false,
      "maxArgsBytes": 1048576,
      "maxResultBytes": 4194304
    },
    {
      "name": "check_building_code_compliance",
      "mutationClass": "read",
      "retryPolicy": "read_only",
      "timeoutMs": 30000,
      "createdIdsRequired": false,
      "sessionTagSupported": false,
      "automaticRollbackAllowed": false,
      "maxArgsBytes": 1048576,
      "maxResultBytes": 4194304
    },
    {
      "name": "color_elements",
      "mutationClass": "mutation",
      "retryPolicy": "never",
      "timeoutMs": 180000,
      "createdIdsRequired": false,
      "sessionTagSupported": false,
      "automaticRollbackAllowed": false,
      "maxArgsBytes": 1048576,
      "maxResultBytes": 4194304
    },
    {
      "name": "compare_design_options",
      "mutationClass": "read",
      "retryPolicy": "read_only",
      "timeoutMs": 30000,
      "createdIdsRequired": false,
      "sessionTagSupported": false,
      "automaticRollbackAllowed": false,
      "maxArgsBytes": 1048576,
      "maxResultBytes": 4194304
    },
    {
      "name": "copy_elements",
      "mutationClass": "mutation",
      "retryPolicy": "never",
      "timeoutMs": 180000,
      "createdIdsRequired": true,
      "sessionTagSupported": false,
      "automaticRollbackAllowed": false,
      "maxArgsBytes": 1048576,
      "maxResultBytes": 4194304
    },
    {
      "name": "create_3d_view",
      "mutationClass": "mutation",
      "retryPolicy": "never",
      "timeoutMs": 180000,
      "createdIdsRequired": true,
      "sessionTagSupported": false,
      "automaticRollbackAllowed": false,
      "maxArgsBytes": 1048576,
      "maxResultBytes": 4194304
    },
    {
      "name": "create_adaptive_component",
      "mutationClass": "mutation",
      "retryPolicy": "never",
      "timeoutMs": 180000,
      "createdIdsRequired": true,
      "sessionTagSupported": false,
      "automaticRollbackAllowed": false,
      "maxArgsBytes": 1048576,
      "maxResultBytes": 4194304
    },
    {
      "name": "create_analytical_model",
      "mutationClass": "mutation",
      "retryPolicy": "never",
      "timeoutMs": 180000,
      "createdIdsRequired": true,
      "sessionTagSupported": false,
      "automaticRollbackAllowed": false,
      "maxArgsBytes": 1048576,
      "maxResultBytes": 4194304
    },
    {
      "name": "create_annotation_symbol",
      "mutationClass": "mutation",
      "retryPolicy": "never",
      "timeoutMs": 180000,
      "createdIdsRequired": true,
      "sessionTagSupported": false,
      "automaticRollbackAllowed": false,
      "maxArgsBytes": 1048576,
      "maxResultBytes": 4194304
    },
    {
      "name": "create_area_plan",
      "mutationClass": "mutation",
      "retryPolicy": "never",
      "timeoutMs": 180000,
      "createdIdsRequired": true,
      "sessionTagSupported": false,
      "automaticRollbackAllowed": false,
      "maxArgsBytes": 1048576,
      "maxResultBytes": 4194304
    },
    {
      "name": "create_assembly",
      "mutationClass": "dangerous",
      "retryPolicy": "never",
      "timeoutMs": 180000,
      "createdIdsRequired": true,
      "sessionTagSupported": false,
      "automaticRollbackAllowed": false,
      "maxArgsBytes": 1048576,
      "maxResultBytes": 4194304
    },
    {
      "name": "create_beam",
      "mutationClass": "mutation",
      "retryPolicy": "never",
      "timeoutMs": 180000,
      "createdIdsRequired": true,
      "sessionTagSupported": false,
      "automaticRollbackAllowed": false,
      "maxArgsBytes": 1048576,
      "maxResultBytes": 4194304
    },
    {
      "name": "create_brace",
      "mutationClass": "mutation",
      "retryPolicy": "never",
      "timeoutMs": 180000,
      "createdIdsRequired": true,
      "sessionTagSupported": false,
      "automaticRollbackAllowed": false,
      "maxArgsBytes": 1048576,
      "maxResultBytes": 4194304
    },
    {
      "name": "create_building_pad",
      "mutationClass": "mutation",
      "retryPolicy": "never",
      "timeoutMs": 180000,
      "createdIdsRequired": true,
      "sessionTagSupported": false,
      "automaticRollbackAllowed": false,
      "maxArgsBytes": 1048576,
      "maxResultBytes": 4194304
    },
    {
      "name": "create_callout",
      "mutationClass": "mutation",
      "retryPolicy": "never",
      "timeoutMs": 180000,
      "createdIdsRequired": true,
      "sessionTagSupported": false,
      "automaticRollbackAllowed": false,
      "maxArgsBytes": 1048576,
      "maxResultBytes": 4194304
    },
    {
      "name": "create_ceiling",
      "mutationClass": "mutation",
      "retryPolicy": "never",
      "timeoutMs": 180000,
      "createdIdsRequired": true,
      "sessionTagSupported": false,